/home/maxime/Projects/dspy/docs/docs/tutorials/output_refinement/best-of-n-and-refine.md	3	modules	module	Refinement BestOfN and Refine Both BestOfN and Refine are DSPy	designed to improve the reliability and quality of predictions by
/home/maxime/Projects/dspy/docs/docs/tutorials/output_refinement/best-of-n-and-refine.md	3	modules	module	LM calls with different rollout IDs to bypass caching Both	stop when they have reached N attempts or when the
/home/maxime/Projects/dspy/docs/docs/tutorials/output_refinement/best-of-n-and-refine.md	7	module	module	returns an award above the threshold BestOfN BestOfN is a	that runs the provided module multiple times up to N
/home/maxime/Projects/dspy/docs/docs/tutorials/output_refinement/best-of-n-and-refine.md	7	module	module	threshold BestOfN BestOfN is a module that runs the provided	multiple times up to N with different rollout IDs It
/home/maxime/Projects/dspy/docs/docs/tutorials/output_refinement/best-of-n-and-refine.md	20	module	module	pred answer split 1 else 0 0 best_of_3 dspy BestOfN	dspy ChainOfThought question answer N 3 reward_fn one_word_answer threshold 1
/home/maxime/Projects/dspy/docs/docs/tutorials/output_refinement/best-of-n-and-refine.md	32	module	module	print result answer Brussels Error Handling By default if the	encounters an error during an attempt it will continue trying
/home/maxime/Projects/dspy/docs/docs/tutorials/output_refinement/best-of-n-and-refine.md	36	module	module	this behavior with the fail_count parameter python best_of_3 dspy BestOfN	qa N 3 reward_fn one_word_answer threshold 1 0 fail_count 1
/home/maxime/Projects/dspy/docs/docs/tutorials/output_refinement/best-of-n-and-refine.md	49	module's	module	the final one it automatically generates detailed feedback about the	performance and uses this feedback as hints for subsequent runs
/home/maxime/Projects/dspy/docs/docs/tutorials/output_refinement/best-of-n-and-refine.md	60	module	module	pred answer split 1 else 0 0 refine dspy Refine	dspy ChainOfThought question answer N 3 reward_fn one_word_answer threshold 1
/home/maxime/Projects/dspy/docs/docs/tutorials/output_refinement/best-of-n-and-refine.md	77	module	module	parameter python Stop after the first error refine dspy Refine	qa N 3 reward_fn one_word_answer threshold 1 0 fail_count 1
/home/maxime/Projects/dspy/docs/docs/tutorials/output_refinement/best-of-n-and-refine.md	87	modules	module	threshold 1 0 fail_count 1 Comparison BestOfN vs Refine Both	serve similar purposes but differ in their approach BestOfN simply
/home/maxime/Projects/dspy/docs/docs/tutorials/output_refinement/best-of-n-and-refine.md	90	module's	module	using the lm to generate a detailed feedback about the	own performance using the previous prediction and the code in
/home/maxime/Projects/dspy/docs/docs/tutorials/output_refinement/best-of-n-and-refine.md	112	module	module	0 if result is_factual else 0 0 refined_qa dspy Refine	dspy ChainOfThought question answer N 3 reward_fn factuality_reward threshold 1
/home/maxime/Projects/dspy/docs/docs/tutorials/output_refinement/best-of-n-and-refine.md	136	module	module	max 0 0 1 0 distance 125 optimized_summarizer dspy BestOfN	dspy ChainOfThought text summary N 50 reward_fn ideal_length_reward threshold 0
/home/maxime/Projects/dspy/docs/docs/tutorials/papillon/index.md	5	Module	module	more advanced context 1 It builds a multi stage dspy	that involves a small local LM using an external tool
/home/maxime/Projects/dspy/docs/docs/tutorials/papillon/index.md	7	Module	module	evaluation 3 It uses this judge for optimizing the dspy	using a large model as a teacher for a small
/home/maxime/Projects/dspy/docs/docs/tutorials/sample_code_generation/index.md	122	Module	module	dspy OutputField desc Required imports and dependencies class DocumentationLearningAgent dspy	Agent that learns from documentation URLs and generates code examples
/home/maxime/Projects/dspy/docs/docs/tutorials/saving/index.md	11	modules	module	the program It also includes configurable attributes of other DSPy	like k for dspy retrievers Retriever To save the state
/home/maxime/Projects/dspy/docs/docs/tutorials/saving/index.md	108	Modules	module	the suitable saving approach based on your needs Serializing Imported	When saving a program with save_program True you might need
/home/maxime/Projects/dspy/docs/docs/tutorials/saving/index.md	110	modules	module	program with save_program True you might need to include custom	that your program depends on This is necessary if your
/home/maxime/Projects/dspy/docs/docs/tutorials/saving/index.md	111	modules	module	on This is necessary if your program depends on these	but at loading time these modules are not imported before
/home/maxime/Projects/dspy/docs/docs/tutorials/saving/index.md	111	modules	module	program depends on these modules but at loading time these	are not imported before calling dspy load You can specify
/home/maxime/Projects/dspy/docs/docs/tutorials/saving/index.md	113	modules	module	imported before calling dspy load You can specify which custom	should be serialized with your program by passing them to
/home/maxime/Projects/dspy/docs/docs/tutorials/saving/index.md	113	modules_to_serialize	module	be serialized with your program by passing them to the	parameter when calling save This ensures that any dependencies your
/home/maxime/Projects/dspy/docs/docs/tutorials/saving/index.md	117	module	module	hood this uses cloudpickle's cloudpickle register_pickle_by_value function to register a	as picklable by value When a module is registered this
/home/maxime/Projects/dspy/docs/docs/tutorials/saving/index.md	118	module	module	to register a module as picklable by value When a	is registered this way cloudpickle will serialize the module by
/home/maxime/Projects/dspy/docs/docs/tutorials/saving/index.md	118	module	module	a module is registered this way cloudpickle will serialize the	by value rather than by reference ensuring that the module
/home/maxime/Projects/dspy/docs/docs/tutorials/saving/index.md	119	module	module	module by value rather than by reference ensuring that the	contents are preserved with the saved program For example if
/home/maxime/Projects/dspy/docs/docs/tutorials/saving/index.md	121	modules	module	the saved program For example if your program uses custom	python import dspy import my_custom_module compiled_dspy_program dspy ChainOfThought my_custom_module custom_signature
/home/maxime/Projects/dspy/docs/docs/tutorials/saving/index.md	125	my_custom_module	module	if your program uses custom modules python import dspy import	compiled_dspy_program dspy ChainOfThought my_custom_module custom_signature Save the program with the
/home/maxime/Projects/dspy/docs/docs/tutorials/saving/index.md	127	my_custom_module	module	custom modules python import dspy import my_custom_module compiled_dspy_program dspy ChainOfThought	custom_signature Save the program with the custom module compiled_dspy_program save
/home/maxime/Projects/dspy/docs/docs/tutorials/saving/index.md	129	module	module	dspy ChainOfThought my_custom_module custom_signature Save the program with the custom	compiled_dspy_program save dspy_program save_program True modules_to_serialize my_custom_module This ensures that
/home/maxime/Projects/dspy/docs/docs/tutorials/saving/index.md	133	modules_to_serialize	module	program with the custom module compiled_dspy_program save dspy_program save_program True	my_custom_module This ensures that the required modules are properly serialized
/home/maxime/Projects/dspy/docs/docs/tutorials/saving/index.md	133	my_custom_module	module	with the custom module compiled_dspy_program save dspy_program save_program True modules_to_serialize	This ensures that the required modules are properly serialized and
/home/maxime/Projects/dspy/docs/docs/tutorials/saving/index.md	137	modules	module	dspy_program save_program True modules_to_serialize my_custom_module This ensures that the required	are properly serialized and available when loading the program later
/home/maxime/Projects/dspy/docs/docs/tutorials/saving/index.md	138	modules	module	and available when loading the program later Any number of	can be passed to modules_to_serialize If you don't specify modules_to_serialize
/home/maxime/Projects/dspy/docs/docs/tutorials/saving/index.md	138	modules_to_serialize	module	program later Any number of modules can be passed to	If you don't specify modules_to_serialize no additional modules will be
/home/maxime/Projects/dspy/docs/docs/tutorials/saving/index.md	138	modules_to_serialize	module	modules can be passed to modules_to_serialize If you don't specify	no additional modules will be registered for serialization Backward Compatibility
/home/maxime/Projects/dspy/docs/docs/tutorials/saving/index.md	138	modules	module	passed to modules_to_serialize If you don't specify modules_to_serialize no additional	will be registered for serialization Backward Compatibility As of dspy
/home/maxime/Projects/dspy/docs/docs/tutorials/streaming/index.md	11	module	module	Output Token Streaming DSPy's token streaming feature works with any	in your pipeline not just the final output The only
/home/maxime/Projects/dspy/docs/docs/tutorials/streaming/index.md	125	module	module	StreamListener for each one Here's an example with a multi	program python import asyncio import dspy lm dspy LM openai
/home/maxime/Projects/dspy/docs/docs/tutorials/streaming/index.md	136	MyModule	module	gpt 4o mini cache False dspy configure lm lm class	dspy Module def __init__ self super __init__ self predict1 dspy
/home/maxime/Projects/dspy/docs/docs/tutorials/streaming/index.md	136	Module	module	mini cache False dspy configure lm lm class MyModule dspy	def __init__ self super __init__ self predict1 dspy Predict question
/home/maxime/Projects/dspy/docs/docs/tutorials/streaming/index.md	149	MyModule	module	question question simplified_answer self predict2 answer answer return simplified_answer predict	stream_listeners dspy streaming StreamListener signature_field_name answer dspy streaming StreamListener signature_field_name
/home/maxime/Projects/dspy/docs/docs/tutorials/streaming/index.md	197	module	module	can introduce significant overhead However in scenarios where a DSPy	is used repeatedly in a loop such as with dspy
/home/maxime/Projects/dspy/docs/docs/tutorials/streaming/index.md	254	modules	module	Names When streaming fields with the same name from different	specify both the predict and predict_name in the StreamListener python
/home/maxime/Projects/dspy/docs/docs/tutorials/streaming/index.md	265	MyModule	module	gpt 4o mini cache False dspy configure lm lm class	dspy Module def __init__ self super __init__ self predict1 dspy
/home/maxime/Projects/dspy/docs/docs/tutorials/streaming/index.md	265	Module	module	mini cache False dspy configure lm lm class MyModule dspy	def __init__ self super __init__ self predict1 dspy Predict question
/home/maxime/Projects/dspy/docs/docs/tutorials/streaming/index.md	278	MyModule	module	question question simplified_answer self predict2 answer answer return simplified_answer predict	stream_listeners dspy streaming StreamListener signature_field_name answer predict predict predict1 predict_name
/home/maxime/Projects/dspy/docs/docs/tutorials/streaming/index.md	356	module_start_status_message	module	lm_end_status_message status message at the end of calling dspy LM	status message at the start of calling a dspy Module
/home/maxime/Projects/dspy/docs/docs/tutorials/streaming/index.md	356	Module	module	module_start_status_message status message at the start of calling a dspy	module_end_status_message status message at the start of calling a dspy
/home/maxime/Projects/dspy/docs/docs/tutorials/streaming/index.md	357	module_end_status_message	module	status message at the start of calling a dspy Module	status message at the start of calling a dspy Module
/home/maxime/Projects/dspy/docs/docs/tutorials/streaming/index.md	357	Module	module	module_end_status_message status message at the start of calling a dspy	tool_start_status_message status message at the start of calling dspy Tool
/home/maxime/Projects/dspy/docs/docs/tutorials/streaming/index.md	377	MyModule	module	gpt 4o mini cache False dspy configure lm lm class	dspy Module def __init__ self super __init__ self tool dspy
/home/maxime/Projects/dspy/docs/docs/tutorials/streaming/index.md	377	Module	module	mini cache False dspy configure lm lm class MyModule dspy	def __init__ self super __init__ self tool dspy Tool lambda
/home/maxime/Projects/dspy/docs/docs/tutorials/streaming/index.md	397	MyModule	module	self outputs return f Tool finished with output outputs predict	stream_listeners dspy ChainOfThought has a built in output field called
/home/maxime/Projects/dspy/docs/docs/tutorials/yahoo_finance_react/index.md	91	Module	module	3 Build the Financial ReAct Agent python class FinancialAnalysisAgent dspy	ReAct agent for financial analysis using Yahoo Finance data def
