/home/maxime/Projects/dspy/docs/docs/learn/optimization/optimizers.md	59	modules	module	search over the space of generation instructions demonstrations across your	7 SIMBA api optimizers SIMBA md Uses stochastic mini batch
/home/maxime/Projects/dspy/docs/docs/learn/optimization/optimizers.md	141	module	module	in dspy SemanticF1 metric which is implemented as a DSPy	python linenums 1 class RAG dspy Module def __init__ self
/home/maxime/Projects/dspy/docs/docs/learn/optimization/optimizers.md	144	Module	module	as a DSPy module python linenums 1 class RAG dspy	def __init__ self num_docs 5 self num_docs num_docs self respond
/home/maxime/Projects/dspy/docs/docs/learn/optimization/optimizers.md	188	module	module	openai gpt 4o mini 2024 07 18 Define the DSPy	for classification It will use the hint at training time
/home/maxime/Projects/dspy/docs/docs/learn/programming/7-assertions.md	3	module	module	are deprecated and NOT supported Please use the dspy Refine	instead or dspy Suggest The content below is deprecated and
/home/maxime/Projects/dspy/docs/docs/learn/programming/7-assertions.md	21	module	module	defined error message providing feedback or correction guidance backtrack Optional	Specifies target module for retry attempts upon constraint failure The
/home/maxime/Projects/dspy/docs/docs/learn/programming/7-assertions.md	21	module	module	providing feedback or correction guidance backtrack Optional module Specifies target	for retry attempts upon constraint failure The default backtracking module
/home/maxime/Projects/dspy/docs/docs/learn/programming/7-assertions.md	21	module	module	module for retry attempts upon constraint failure The default backtracking	is the last module before the assertion Behavior Initiates retry
/home/maxime/Projects/dspy/docs/docs/learn/programming/7-assertions.md	21	module	module	upon constraint failure The default backtracking module is the last	before the assertion Behavior Initiates retry upon failure dynamically adjusting
/home/maxime/Projects/dspy/docs/docs/learn/programming/7-assertions.md	50	Module	module	as defined in the intro walkthrough python class SimplifiedBaleen dspy	def __init__ self passages_per_hop 2 max_hops 2 super __init__ self
/home/maxime/Projects/dspy/docs/docs/learn/programming/7-assertions.md	106	target_module	module	100 Query should be short and less than 100 characters	self generate_query dspy Suggest validate_query_distinction_local prev_queries query Query should be
/home/maxime/Projects/dspy/docs/docs/learn/programming/7-assertions.md	113	target_module	module	f i 1 q for i q in enumerate prev_queries	self generate_query It is recommended to define a program with
/home/maxime/Projects/dspy/docs/docs/learn/programming/7-assertions.md	122	Module	module	program will look with Assertions included python class SimplifiedBaleenAssertions dspy	def __init__ self passages_per_hop 2 max_hops 2 super __init__ self
/home/maxime/Projects/dspy/docs/docs/learn/programming/7-assertions.md	140	target_module	module	100 Query should be short and less than 100 characters	self generate_query dspy Suggest validate_query_distinction_local prev_queries query Query should be
/home/maxime/Projects/dspy/docs/docs/learn/programming/7-assertions.md	147	target_module	module	f i 1 q for i q in enumerate prev_queries	self generate_query prev_queries append query passages self retrieve query passages
/home/maxime/Projects/dspy/docs/docs/learn/programming/7-assertions.md	165	assert_transform_module	module	backtracking and Retry logic python from dspy primitives assertions import	backtrack_handler baleen_with_assertions assert_transform_module SimplifiedBaleenAssertions backtrack_handler backtrack_handler is parameterized over a
/home/maxime/Projects/dspy/docs/docs/learn/programming/7-assertions.md	167	assert_transform_module	module	logic python from dspy primitives assertions import assert_transform_module backtrack_handler baleen_with_assertions	SimplifiedBaleenAssertions backtrack_handler backtrack_handler is parameterized over a few settings for
/home/maxime/Projects/dspy/docs/docs/learn/programming/7-assertions.md	171	assert_transform_module	module	the number of max retry attempts you can do baleen_with_assertions_retry_once	SimplifiedBaleenAssertions functools partial backtrack_handler max_backtracks 1 Alternatively you can also
/home/maxime/Projects/dspy/docs/docs/learn/programming/adapters.md	5	module	module	the actual Language Model LM When you call a DSPy	the adapter takes your signature user inputs and other attributes
/home/maxime/Projects/dspy/docs/docs/learn/programming/adapters.md	49	Module	module	1 The user calls their DSPy agent typically a dspy	with inputs 2 The inner dspy Predict is invoked to
/home/maxime/Projects/dspy/docs/docs/learn/programming/language_models.md	157	modules	module	test This is a test Using the LM with DSPy	Idiomatic DSPy involves using _modules_ which we discuss in the
/home/maxime/Projects/dspy/docs/docs/learn/programming/language_models.md	159	_modules_	module	Using the LM with DSPy modules Idiomatic DSPy involves using	which we discuss in the next guide python linenums 1
/home/maxime/Projects/dspy/docs/docs/learn/programming/language_models.md	162	module	module	discuss in the next guide python linenums 1 Define a	ChainOfThought and assign it a signature return an answer given
/home/maxime/Projects/dspy/docs/docs/learn/programming/language_models.md	218	modules	module	0 You can pass these LM kwargs directly to DSPy	as well Supplying them at initialization sets the defaults for
/home/maxime/Projects/dspy/docs/docs/learn/programming/language_models.md	226	module	module	a single invocation provide a config dictionary when calling the	python linenums 1 predict dspy Predict question answer predict question
/home/maxime/Projects/dspy/docs/docs/learn/programming/modules.md	5	Modules	module	sidebar_position 3	A DSPy module is a building block for programs that
/home/maxime/Projects/dspy/docs/docs/learn/programming/modules.md	7	module	module	sidebar_position 3 Modules A DSPy	is a building block for programs that use LMs Each
/home/maxime/Projects/dspy/docs/docs/learn/programming/modules.md	9	module	module	building block for programs that use LMs Each built in	abstracts a prompting technique like chain of thought or ReAct
/home/maxime/Projects/dspy/docs/docs/learn/programming/modules.md	11	module	module	Crucially they are generalized to handle any signature A DSPy	has learnable parameters i e the little pieces comprising the
/home/maxime/Projects/dspy/docs/docs/learn/programming/modules.md	13	modules	module	be invoked called to process inputs and return outputs Multiple	can be composed into bigger modules programs DSPy modules are
/home/maxime/Projects/dspy/docs/docs/learn/programming/modules.md	13	modules	module	and return outputs Multiple modules can be composed into bigger	programs DSPy modules are inspired directly by NN modules in
/home/maxime/Projects/dspy/docs/docs/learn/programming/modules.md	13	modules	module	Multiple modules can be composed into bigger modules programs DSPy	are inspired directly by NN modules in PyTorch but applied
/home/maxime/Projects/dspy/docs/docs/learn/programming/modules.md	13	modules	module	bigger modules programs DSPy modules are inspired directly by NN	in PyTorch but applied to LM programs How do I
/home/maxime/Projects/dspy/docs/docs/learn/programming/modules.md	16	module	module	to LM programs How do I use a built in	like dspy Predict or dspy ChainOfThought Let's start with the
/home/maxime/Projects/dspy/docs/docs/learn/programming/modules.md	18	module	module	Predict or dspy ChainOfThought Let's start with the most fundamental	dspy Predict Internally all other DSPy modules are built using
/home/maxime/Projects/dspy/docs/docs/learn/programming/modules.md	18	modules	module	the most fundamental module dspy Predict Internally all other DSPy	are built using dspy Predict We'll assume you are already
/home/maxime/Projects/dspy/docs/docs/learn/programming/modules.md	18	module	module	which are declarative specs for defining the behavior of any	we use in DSPy To use a module we first
/home/maxime/Projects/dspy/docs/docs/learn/programming/modules.md	20	module	module	of any module we use in DSPy To use a	we first declare it by giving it a signature Then
/home/maxime/Projects/dspy/docs/docs/learn/programming/modules.md	20	module	module	it by giving it a signature Then we call the	with the input arguments and extract the output fields python
/home/maxime/Projects/dspy/docs/docs/learn/programming/modules.md	39	module	module	print response sentiment Output text True When we declare a	we can pass configuration keys to it Below we'll pass
/home/maxime/Projects/dspy/docs/docs/learn/programming/modules.md	66	module	module	queries Let's discuss the output object here The dspy ChainOfThought	will generally inject a reasoning before the output field s
/home/maxime/Projects/dspy/docs/docs/learn/programming/modules.md	93	modules	module	response completions reasoning 3 Output text True What other DSPy	are there How can I use them The others are
/home/maxime/Projects/dspy/docs/docs/learn/programming/modules.md	107	modules	module	final prediction 6 dspy RLM A Recursive Language Model api	RLM md that explores large contexts through a sandboxed Python
/home/maxime/Projects/dspy/docs/docs/learn/programming/modules.md	109	modules	module	in the prompt effectively We also have some function style	7 dspy majority Can do basic voting to return the
/home/maxime/Projects/dspy/docs/docs/learn/programming/modules.md	114	modules	module	a set of predictions info A few examples of DSPy	on simple tasks Try the examples below after configuring your
/home/maxime/Projects/dspy/docs/docs/learn/programming/modules.md	184	module	module	Tim Cook highlighted its new features in a press release	dspy Predict text title headings list str entities_and_metadata list dict
/home/maxime/Projects/dspy/docs/docs/learn/programming/modules.md	185	module	module	title headings list str entities_and_metadata list dict str str response	text text print response title print response headings print response
/home/maxime/Projects/dspy/docs/docs/learn/programming/modules.md	222	modules	module	Possible Output text 5761 328 How do I compose multiple	into a bigger program DSPy is just Python code that
/home/maxime/Projects/dspy/docs/docs/learn/programming/modules.md	224	modules	module	a bigger program DSPy is just Python code that uses	in any control flow you like with a little magic
/home/maxime/Projects/dspy/docs/docs/learn/programming/modules.md	224	modules	module	What this means is that you can just call the	freely See tutorials like multi hop search https dspy ai
/home/maxime/Projects/dspy/docs/docs/learn/programming/modules.md	226	module	module	like multi hop search https dspy ai tutorials multihop_search whose	is reproduced below as an example python linenums 1 class
/home/maxime/Projects/dspy/docs/docs/learn/programming/modules.md	229	Module	module	below as an example python linenums 1 class Hop dspy	def __init__ self num_docs 10 num_hops 4 self num_docs self
/home/maxime/Projects/dspy/docs/docs/learn/programming/modules.md	249	module	module	titles Then you can create a instance of the custom	class Hop then invoke it by the __call__ method hop
/home/maxime/Projects/dspy/docs/docs/learn/programming/modules.md	261	module	module	provides built in tracking of language model usage across all	calls To enable tracking python dspy configure track_usage True Once
/home/maxime/Projects/dspy/docs/docs/learn/programming/modules.md	285	Module	module	simple program that makes multiple LM calls class MyProgram dspy	def __init__ self self predict1 dspy ChainOfThought question answer self
/home/maxime/Projects/dspy/docs/docs/learn/programming/overview.md	9	module	module	initial pipeline Can your DSPy program just be a single	or do you need to break it down into a
/home/maxime/Projects/dspy/docs/docs/learn/programming/overview.md	9	module	module	but start simple perhaps with just a single dspy ChainOfThought	then add complexity incrementally based on observations As you do
/home/maxime/Projects/dspy/docs/docs/learn/programming/overview.md	16	_module_'s	module	strategies like thinking step by step or using tools a	logic and relies on substantial trial and error to discover
/home/maxime/Projects/dspy/docs/docs/learn/programming/overview.md	18	modules	module	portability For example if you write a program using DSPy	you can swap the LM or its adapter without changing
/home/maxime/Projects/dspy/docs/docs/learn/programming/overview.md	18	_module_	module	the rest of your logic Or you can exchange one	like dspy ChainOfThought with another like dspy ProgramOfThought without modifying
/home/maxime/Projects/dspy/docs/docs/learn/programming/signatures.md	9	module	module	a declarative specification of input output behavior of a DSPy	Signatures allow you to tell the LM _what_ it needs
/home/maxime/Projects/dspy/docs/docs/learn/programming/signatures.md	11	modules	module	_describe_ things DSPy Signatures _declare and initialize the behavior_ of	Moreover the field names matter in DSPy Signatures You express
/home/maxime/Projects/dspy/docs/docs/learn/programming/signatures.md	83	modules	module	length of the contract has not been revealed Many DSPy	except dspy Predict return auxiliary information by expanding your signature
/home/maxime/Projects/dspy/docs/docs/learn/programming/signatures.md	183	module	module	types 1 Basic types like str int bool 2 Typing	types like list str dict str int Optional float Union
/home/maxime/Projects/dspy/docs/docs/learn/programming/signatures.md	207	modules	module	query MyContainer Query score MyContainer Score Using signatures to build	compiling them While signatures are convenient for prototyping with structured
/home/maxime/Projects/dspy/docs/docs/learn/programming/signatures.md	211	modules	module	use them You should compose multiple signatures into bigger DSPy	modules md and compile these modules into optimized prompts optimization
/home/maxime/Projects/dspy/docs/docs/learn/programming/signatures.md	211	modules	module	them You should compose multiple signatures into bigger DSPy modules	md and compile these modules into optimized prompts optimization optimizers
/home/maxime/Projects/dspy/docs/docs/learn/programming/signatures.md	211	modules	module	signatures into bigger DSPy modules modules md and compile these	into optimized prompts optimization optimizers md and finetunes
/home/maxime/Projects/dspy/docs/docs/learn/programming/tools.md	16	module	module	Approach 1 Using dspy ReAct Fully Managed The dspy ReAct	implements the Reasoning and Acting ReAct pattern where the language
/home/maxime/Projects/dspy/docs/docs/production/index.md	49	Modules	module	utils asyncify md material alert rhombus __Guardrails Controllability__ DSPy's Signatures	and Optimizers help you control and guide LM outputs octicons
/home/maxime/Projects/dspy/docs/docs/roadmap.md	19	modules	module	for well scoped tasks We need to enable that through	and optimizers that isolate how they decompose their problems and
/home/maxime/Projects/dspy/docs/docs/roadmap.md	21	modules	module	that address the goals above declarative signatures define by run	and optimizers that can be composed quite powerfully But there
/home/maxime/Projects/dspy/docs/docs/roadmap.md	54	Modules	module	small core It s nothing but 1 LMs 2 Signatures	3 Optimizers and 4 Assertions These concepts and their implementations
/home/maxime/Projects/dspy/docs/docs/roadmap.md	70	Modules	module	Cyrus Nouroozi Amir Mehr Kyle Caverly and others On Signatures	Traditionally LMs offer text in text out interfaces Toward modular
/home/maxime/Projects/dspy/docs/docs/roadmap.md	81	modules	module	ultimately we need to bootstrap training data for several different	in a program train multiple models and handle model selection
/home/maxime/Projects/dspy/docs/docs/roadmap.md	81	modules	module	then load and plug in those models into the program's	Doing this robustly at the level of abstraction DSPy offers
/home/maxime/Projects/dspy/docs/docs/tutorials/ai_text_game/index.md	208	Module	module	int dspy OutputField desc Experience points gained class GameAI dspy	Main AI module for game logic and narrative def __init__
/home/maxime/Projects/dspy/docs/docs/tutorials/ai_text_game/index.md	209	module	module	desc Experience points gained class GameAI dspy Module Main AI	for game logic and narrative def __init__ self super __init__
/home/maxime/Projects/dspy/docs/docs/tutorials/async/index.md	5	modules	module	to leverage async capabilities in DSPy covering both built in	and custom implementations Why Use Async in DSPy Asynchronous programming
/home/maxime/Projects/dspy/docs/docs/tutorials/async/index.md	48	Modules	module	with the additional complexity of async programming Using Built in	Asynchronously Most DSPy built in modules support asynchronous operations through
/home/maxime/Projects/dspy/docs/docs/tutorials/async/index.md	50	modules	module	programming Using Built in Modules Asynchronously Most DSPy built in	support asynchronous operations through the acall method This method maintains
/home/maxime/Projects/dspy/docs/docs/tutorials/async/index.md	132	Modules	module	tools asynchronously using their acall methods Creating Custom Async DSPy	To create your own async DSPy module implement the aforward
/home/maxime/Projects/dspy/docs/docs/tutorials/async/index.md	134	module	module	Custom Async DSPy Modules To create your own async DSPy	implement the aforward method instead of forward This method should
/home/maxime/Projects/dspy/docs/docs/tutorials/async/index.md	135	module's	module	aforward method instead of forward This method should contain your	async logic Here's an example of a custom module that
/home/maxime/Projects/dspy/docs/docs/tutorials/async/index.md	135	module	module	your module's async logic Here's an example of a custom	that chains two async operations python import dspy import asyncio
/home/maxime/Projects/dspy/docs/docs/tutorials/async/index.md	145	MyModule	module	dspy configure lm dspy LM openai gpt 4o mini class	dspy Module def __init__ self self predict1 dspy ChainOfThought question
/home/maxime/Projects/dspy/docs/docs/tutorials/async/index.md	145	Module	module	lm dspy LM openai gpt 4o mini class MyModule dspy	def __init__ self self predict1 dspy ChainOfThought question answer self
/home/maxime/Projects/dspy/docs/docs/tutorials/async/index.md	157	MyModule	module	await self predict2 acall answer answer async def main mod	result await mod acall question Why did a chicken cross
/home/maxime/Projects/dspy/docs/docs/tutorials/build_ai_program/index.md	13	Modules	module	and provide helpful responses Building AI Applications by Customizing DSPy	custom_module index ipynb Discover how to create custom DSPy modules
/home/maxime/Projects/dspy/docs/docs/tutorials/build_ai_program/index.md	13	custom_module	module	provide helpful responses Building AI Applications by Customizing DSPy Modules	index ipynb Discover how to create custom DSPy modules tailored
/home/maxime/Projects/dspy/docs/docs/tutorials/build_ai_program/index.md	14	modules	module	Modules custom_module index ipynb Discover how to create custom DSPy	tailored to your specific needs Learn the patterns for building
/home/maxime/Projects/dspy/docs/docs/tutorials/cache/index.md	17	module	module	hit occurs you will observe a significant reduction in the	call's execution time Furthermore if usage tracking is enabled the
/home/maxime/Projects/dspy/docs/docs/tutorials/cache/index.md	53	modules	module	and OpenAI This feature is particularly useful when working with	like dspy ReAct that send similar prompts repeatedly as it
/home/maxime/Projects/dspy/docs/docs/tutorials/cache/index.md	73	module	module	role system dspy configure lm lm Use with any DSPy	predict dspy Predict question answer result predict question What is
/home/maxime/Projects/dspy/docs/docs/tutorials/conversation_history/index.md	3	Module	module	DSPy does not provide automatic conversation history management within dspy	it offers the dspy History utility to help you manage
/home/maxime/Projects/dspy/docs/docs/tutorials/deployment/index.md	153	Module	module	you must wrap your DSPy program in a custom DSPy	class when deploying with MLflow This is because MLflow requires
/home/maxime/Projects/dspy/docs/docs/tutorials/deployment/index.md	154	modules	module	is because MLflow requires positional arguments while DSPy pre built	disallow positional arguments e g dspy Predict or dspy ChainOfThought
/home/maxime/Projects/dspy/docs/docs/tutorials/deployment/index.md	155	Module	module	around this create a wrapper class that inherits from dspy	and implement your program's logic in the forward method as
/home/maxime/Projects/dspy/docs/docs/tutorials/deployment/index.md	168	Module	module	gpt 4o mini dspy configure lm lm class MyProgram dspy	def __init__ self super __init__ self cot dspy ChainOfThought question
/home/maxime/Projects/dspy/docs/docs/tutorials/email_extraction/index.md	17	modules	module	Handle multiple email formats robustly Prerequisites Basic understanding of DSPy	and signatures Python 3 9 installed OpenAI API key or
/home/maxime/Projects/dspy/docs/docs/tutorials/email_extraction/index.md	147	Module	module	the email's main points Step 3 Build the Email Processing	Now let's create our main email processing module python class
/home/maxime/Projects/dspy/docs/docs/tutorials/email_extraction/index.md	149	module	module	Email Processing Module Now let's create our main email processing	python class EmailProcessor dspy Module A comprehensive email processing system
/home/maxime/Projects/dspy/docs/docs/tutorials/email_extraction/index.md	152	Module	module	create our main email processing module python class EmailProcessor dspy	A comprehensive email processing system using DSPy def __init__ self
/home/maxime/Projects/dspy/docs/docs/tutorials/index.md	18	Modules	module	DSPy customer_service_agent index ipynb Building AI Applications by Customizing DSPy	custom_module index ipynb Retrieval Augmented Generation RAG rag index ipynb
/home/maxime/Projects/dspy/docs/docs/tutorials/index.md	18	custom_module	module	customer_service_agent index ipynb Building AI Applications by Customizing DSPy Modules	index ipynb Retrieval Augmented Generation RAG rag index ipynb Building
/home/maxime/Projects/dspy/docs/docs/tutorials/llms_txt_generation/index.md	59	Module	module	following the standard format Step 2 Create the Repository Analyzer	python class RepositoryAnalyzer dspy Module def __init__ self super __init__
/home/maxime/Projects/dspy/docs/docs/tutorials/llms_txt_generation/index.md	62	Module	module	2 Create the Repository Analyzer Module python class RepositoryAnalyzer dspy	def __init__ self super __init__ self analyze_repo dspy ChainOfThought AnalyzeRepository
/home/maxime/Projects/dspy/docs/docs/tutorials/llms_txt_generation/index.md	223	Modules	module	framework for programming rather than prompting language models Key Concepts	Building blocks for LM programs Signatures Input output specifications Teleprompters
/home/maxime/Projects/dspy/docs/docs/tutorials/llms_txt_generation/index.md	232	modules	module	output format handlers clients LM client interfaces predict Core prediction	teleprompt Optimization algorithms Usage Examples 1 Building a Classifier Using
/home/maxime/Projects/dspy/docs/docs/tutorials/llms_txt_generation/index.md	240	modules	module	Compositional Code Developers can write compositional code that allows different	of the AI system to interact with each other enabling
/home/maxime/Projects/dspy/docs/docs/tutorials/mcp/index.md	451	module	module	that utilizes a custom MCP server and the dspy ReAct	In the context of MCP support DSPy provides a simple
/home/maxime/Projects/dspy/docs/docs/tutorials/mem0_react_agent/index.md	143	Module	module	str dspy InputField response str dspy OutputField class MemoryReActAgent dspy	A ReAct agent enhanced with Mem0 memory capabilities def __init__
/home/maxime/Projects/dspy/docs/docs/tutorials/observability/index.md	82	modules	module	real world systems other components like retrievers tools and custom	play significant roles but inspect_history only logs LLM calls DSPy
/home/maxime/Projects/dspy/docs/docs/tutorials/observability/index.md	84	modules	module	questions Metadata such as parameters latency and the relationship between	are not captured Tracing addresses these limitations and provides a
/home/maxime/Projects/dspy/docs/docs/tutorials/observability/index.md	198	module	module	might need to log specific events triggered by a particular	DSPy's callback mechanism supports such use cases The BaseCallback class
/home/maxime/Projects/dspy/docs/docs/tutorials/observability/index.md	202	on_module_start	module	class provides several handlers for customizing logging behavior Handlers Description	on_module_end Triggered when a dspy Module subclass is invoked on_lm_start
/home/maxime/Projects/dspy/docs/docs/tutorials/observability/index.md	202	on_module_end	module	provides several handlers for customizing logging behavior Handlers Description on_module_start	Triggered when a dspy Module subclass is invoked on_lm_start on_lm_end
/home/maxime/Projects/dspy/docs/docs/tutorials/observability/index.md	202	Module	module	logging behavior Handlers Description on_module_start on_module_end Triggered when a dspy	subclass is invoked on_lm_start on_lm_end Triggered when a dspy LM
/home/maxime/Projects/dspy/docs/docs/tutorials/observability/index.md	218	on_module_end	module	class that extends BaseCallback class class AgentLoggingCallback BaseCallback 2 Implement	handler to run a custom logging code def on_module_end self
/home/maxime/Projects/dspy/docs/docs/tutorials/observability/index.md	219	on_module_end	module	Implement on_module_end handler to run a custom logging code def	self call_id outputs exception step Reasoning if self _is_reasoning_output outputs
