/home/maxime/Projects/dspy/docs/docs/learn/optimization/optimizers.md	48	program	program	the optimization including candidates of the uncompiled program LabeledFewShot optimized	BootstrapFewShot compiled program with unshuffled examples and num_candidate_programs of BootstrapFewShot
/home/maxime/Projects/dspy/docs/docs/learn/optimization/optimizers.md	48	program	program	candidates of the uncompiled program LabeledFewShot optimized program BootstrapFewShot compiled	with unshuffled examples and num_candidate_programs of BootstrapFewShot compiled programs with
/home/maxime/Projects/dspy/docs/docs/learn/optimization/optimizers.md	48	num_candidate_programs	program	LabeledFewShot optimized program BootstrapFewShot compiled program with unshuffled examples and	of BootstrapFewShot compiled programs with randomized example sets 4 KNNFewShot
/home/maxime/Projects/dspy/docs/docs/learn/optimization/optimizers.md	48	programs	program	compiled program with unshuffled examples and num_candidate_programs of BootstrapFewShot compiled	with randomized example sets 4 KNNFewShot api optimizers KNNFewShot md
/home/maxime/Projects/dspy/docs/docs/learn/optimization/optimizers.md	63	program's	program	GEPA overview md Uses LM's to reflect on the DSPy	trajectory to identify what worked what didn't and propose prompts
/home/maxime/Projects/dspy/docs/docs/learn/optimization/optimizers.md	63	program	program	leverage domain specific textual feedback to rapidly improve the DSPy	Detailed tutorials on using GEPA are available at dspy GEPA
/home/maxime/Projects/dspy/docs/docs/learn/optimization/optimizers.md	63	gepa_ai_program	program	on using GEPA are available at dspy GEPA Tutorials tutorials	index md Automatic Finetuning This optimizer is used to fine
/home/maxime/Projects/dspy/docs/docs/learn/optimization/optimizers.md	69	program	program	9 BootstrapFinetune api optimizers BootstrapFinetune Distills a prompt based DSPy	into weight updates The output is a DSPy program that
/home/maxime/Projects/dspy/docs/docs/learn/optimization/optimizers.md	69	program	program	DSPy program into weight updates The output is a DSPy	that has the same steps but where each step is
/home/maxime/Projects/dspy/docs/docs/learn/optimization/optimizers.md	72	Program	program	tutorial https dspy ai tutorials classification_finetuning for a complete example	Transformations 10 Ensemble api optimizers Ensemble md Ensembles a set
/home/maxime/Projects/dspy/docs/docs/learn/optimization/optimizers.md	74	programs	program	Ensemble api optimizers Ensemble md Ensembles a set of DSPy	and either uses the full set or randomly samples a
/home/maxime/Projects/dspy/docs/docs/learn/optimization/optimizers.md	74	program	program	full set or randomly samples a subset into a single	Meta Optimizers 11 BetterTogether api optimizers BetterTogether md A meta
/home/maxime/Projects/dspy/docs/docs/learn/optimization/optimizers.md	91	program	program	g 7B parameters or above and need a very efficient	finetune a small LM for your task with BootstrapFinetune How
/home/maxime/Projects/dspy/docs/docs/learn/optimization/optimizers.md	102	program's	program	bootstrap i e self generate 8 shot examples of your	steps The optimizer will repeat this 10 times plus some
/home/maxime/Projects/dspy/docs/docs/learn/optimization/optimizers.md	104	num_candidate_programs	program	attempt on the devset config dict max_bootstrapped_demos 4 max_labeled_demos 4	10 num_threads 4 teleprompter BootstrapFewShotWithRandomSearch metric YOUR_METRIC_HERE config optimized_program teleprompter
/home/maxime/Projects/dspy/docs/docs/learn/optimization/optimizers.md	107	optimized_program	program	4 num_candidate_programs 10 num_threads 4 teleprompter BootstrapFewShotWithRandomSearch metric YOUR_METRIC_HERE config	teleprompter compile YOUR_PROGRAM_HERE trainset YOUR_TRAINSET_HERE info Getting Started III Optimizing
/home/maxime/Projects/dspy/docs/docs/learn/optimization/optimizers.md	107	YOUR_PROGRAM_HERE	program	num_threads 4 teleprompter BootstrapFewShotWithRandomSearch metric YOUR_METRIC_HERE config optimized_program teleprompter compile	trainset YOUR_TRAINSET_HERE info Getting Started III Optimizing the LM prompts
/home/maxime/Projects/dspy/docs/docs/learn/optimization/optimizers.md	111	programs	program	Started III Optimizing the LM prompts or weights in DSPy	A typical simple optimization run costs on the order of
/home/maxime/Projects/dspy/docs/docs/learn/optimization/optimizers.md	215	program	program	to 87 Saving and loading optimizer output After running a	through an optimizer it's useful to also save it At
/home/maxime/Projects/dspy/docs/docs/learn/optimization/optimizers.md	215	program	program	useful to also save it At a later point a	can be loaded from a file and used for inference
/home/maxime/Projects/dspy/docs/docs/learn/optimization/optimizers.md	218	optimized_program	program	this the load and save methods can be used python	save YOUR_SAVE_PATH The resulting file is in plain text JSON
/home/maxime/Projects/dspy/docs/docs/learn/optimization/optimizers.md	221	program	program	It contains all the parameters and steps in the source	You can always read it and see what the optimizer
/home/maxime/Projects/dspy/docs/docs/learn/optimization/optimizers.md	224	program	program	it and see what the optimizer generated To load a	from a file you can instantiate an object from that
/home/maxime/Projects/dspy/docs/docs/learn/optimization/optimizers.md	227	loaded_program	program	class and then call the load method on it python	YOUR_PROGRAM_CLASS loaded_program load path YOUR_SAVE_PATH
/home/maxime/Projects/dspy/docs/docs/learn/optimization/optimizers.md	227	YOUR_PROGRAM_CLASS	program	and then call the load method on it python loaded_program	loaded_program load path YOUR_SAVE_PATH
/home/maxime/Projects/dspy/docs/docs/learn/optimization/optimizers.md	228	loaded_program	program	then call the load method on it python loaded_program YOUR_PROGRAM_CLASS	load path YOUR_SAVE_PATH
/home/maxime/Projects/dspy/docs/docs/learn/optimization/overview.md	8	program	program	DSPy optimizers to tune the prompts or weights in your	Now it's useful to expand your data collection effort into
/home/maxime/Projects/dspy/docs/docs/learn/optimization/overview.md	8	gepa_ai_program	program	sets In contrast the dspy GEPA https dspy ai tutorials	optimizer follows the more standard ML convention Maximize the training
/home/maxime/Projects/dspy/docs/docs/learn/optimization/overview.md	10	program	program	of progress but you don't like something about the final	or the metric At this point go back to step
/home/maxime/Projects/dspy/docs/docs/learn/optimization/overview.md	10	Programming	program	the metric At this point go back to step 1	in DSPy and revisit the major questions Did you define
/home/maxime/Projects/dspy/docs/docs/learn/optimization/overview.md	10	program	program	to add some more complexity or steps in your DSPy	itself Do you want to use multiple optimizers in a
/home/maxime/Projects/dspy/docs/docs/learn/optimization/overview.md	12	program	program	pieces to do that incrementally iterating on your data your	structure your metric and your optimization steps Optimizing complex LM
/home/maxime/Projects/dspy/docs/docs/learn/optimization/overview.md	12	programs	program	structure your metric and your optimization steps Optimizing complex LM	is an entirely new paradigm that only exists in DSPy
/home/maxime/Projects/dspy/docs/docs/learn/programming/7-assertions.md	9	programming	program	LMs in adhering to specific constraints Even DSPy's modularity of	prompting pipelines lacks mechanisms to effectively and automatically enforce these
/home/maxime/Projects/dspy/docs/docs/learn/programming/7-assertions.md	28	program	program	Python Assertions Unlike conventional Python assert statements that terminate the	upon failure dspy Assert conducts a sophisticated retry mechanism allowing
/home/maxime/Projects/dspy/docs/docs/learn/programming/7-assertions.md	33	program	program	through signature modification Dynamic Signature Modification internally modifying your DSPy	s Signature by adding the following fields Past Output your
/home/maxime/Projects/dspy/docs/docs/learn/programming/7-assertions.md	37	program	program	execution alerting you with an dspy AssertionError This ensures your	doesn't continue executing with bad LM behavior and immediately highlights
/home/maxime/Projects/dspy/docs/docs/learn/programming/7-assertions.md	39	program	program	will log the persistent failure and continue execution of the	on the rest of the data This ensures the LM
/home/maxime/Projects/dspy/docs/docs/learn/programming/7-assertions.md	45	Programs	program	in the development cycle Use Case Including Assertions in DSPy	We start with using an example of a multi hop
/home/maxime/Projects/dspy/docs/docs/learn/programming/7-assertions.md	100	program	program	through dspy Suggest statements as we want to test the	in a best effort demonstration We want to keep these
/home/maxime/Projects/dspy/docs/docs/learn/programming/7-assertions.md	117	program	program	prev_queries target_module self generate_query It is recommended to define a	with assertions separately than your original program if you are
/home/maxime/Projects/dspy/docs/docs/learn/programming/7-assertions.md	117	program	program	to define a program with assertions separately than your original	if you are doing comparative evaluation for the effect of
/home/maxime/Projects/dspy/docs/docs/learn/programming/7-assertions.md	119	program	program	Assertions away Let's take a look at how the SimplifiedBaleen	will look with Assertions included python class SimplifiedBaleenAssertions dspy Module
/home/maxime/Projects/dspy/docs/docs/learn/programming/7-assertions.md	162	programs	program	Prediction context context answer pred answer return pred Now calling	with DSPy Assertions requires one last step and that is
/home/maxime/Projects/dspy/docs/docs/learn/programming/7-assertions.md	162	program	program	Assertions requires one last step and that is transforming the	to wrap it with internal assertions backtracking and Retry logic
/home/maxime/Projects/dspy/docs/docs/learn/programming/7-assertions.md	175	program	program	1 Alternatively you can also directly call activate_assertions on the	with dspy Assert Suggest statements using the default backtracking mechanism
/home/maxime/Projects/dspy/docs/docs/learn/programming/7-assertions.md	258	num_candidate_programs	program	during inference time python teleprompter BootstrapFewShotWithRandomSearch metric validate_context_and_answer_and_hops max_bootstrapped_demos max_bootstrapped_demos	6 Compilation with Assertions compiled_with_assertions_baleen teleprompter compile student baleen teacher
/home/maxime/Projects/dspy/docs/docs/learn/programming/adapters.md	335	programs	program	adapters will help you build more reliable and efficient DSPy	
/home/maxime/Projects/dspy/docs/docs/learn/programming/modules.md	7	programs	program	3 Modules A DSPy module is a building block for	that use LMs Each built in module abstracts a prompting
/home/maxime/Projects/dspy/docs/docs/learn/programming/modules.md	13	programs	program	return outputs Multiple modules can be composed into bigger modules	DSPy modules are inspired directly by NN modules in PyTorch
/home/maxime/Projects/dspy/docs/docs/learn/programming/modules.md	13	programs	program	directly by NN modules in PyTorch but applied to LM	How do I use a built in module like dspy
/home/maxime/Projects/dspy/docs/docs/learn/programming/modules.md	101	ProgramOfThought	program	by step before committing to the signature's response 3 dspy	Teaches the LM to output code whose execution results will
/home/maxime/Projects/dspy/docs/docs/learn/programming/modules.md	222	program	program	328 How do I compose multiple modules into a bigger	DSPy is just Python code that uses modules in any
/home/maxime/Projects/dspy/docs/docs/learn/programming/modules.md	284	program	program	gpt 4o mini cache False track_usage True Define a simple	that makes multiple LM calls class MyProgram dspy Module def
/home/maxime/Projects/dspy/docs/docs/learn/programming/modules.md	285	MyProgram	program	Define a simple program that makes multiple LM calls class	dspy Module def __init__ self self predict1 dspy ChainOfThought question
/home/maxime/Projects/dspy/docs/docs/learn/programming/modules.md	295	program	program	self predict2 question question answer answer return score Run the	and check usage program MyProgram output program question What is
/home/maxime/Projects/dspy/docs/docs/learn/programming/modules.md	296	program	program	answer answer return score Run the program and check usage	MyProgram output program question What is the capital of France
/home/maxime/Projects/dspy/docs/docs/learn/programming/modules.md	296	MyProgram	program	answer return score Run the program and check usage program	output program question What is the capital of France print
/home/maxime/Projects/dspy/docs/docs/learn/programming/modules.md	297	program	program	score Run the program and check usage program MyProgram output	question What is the capital of France print output get_lm_usage
/home/maxime/Projects/dspy/docs/docs/learn/programming/modules.md	335	program	program	dspy LM openai gpt 4o mini cache True track_usage True	MyProgram First call will show usage statistics output program question
/home/maxime/Projects/dspy/docs/docs/learn/programming/modules.md	335	MyProgram	program	LM openai gpt 4o mini cache True track_usage True program	First call will show usage statistics output program question What
/home/maxime/Projects/dspy/docs/docs/learn/programming/modules.md	338	program	program	True program MyProgram First call will show usage statistics output	question What is the capital of Zambia print output get_lm_usage
/home/maxime/Projects/dspy/docs/docs/learn/programming/modules.md	342	program	program	token usage Second call same question will use cache output	question What is the capital of Zambia print output get_lm_usage
/home/maxime/Projects/dspy/docs/docs/learn/programming/overview.md	5	Programming	program	sidebar_position 1	in DSPy DSPy is a bet on _writing code instead
/home/maxime/Projects/dspy/docs/docs/learn/programming/overview.md	9	program	program	with citations Next define your initial pipeline Can your DSPy	just be a single module or do you need to
/home/maxime/Projects/dspy/docs/docs/learn/programming/overview.md	11	program	program	try a handful of examples of the inputs to your	Consider using a powerful LM at this point or a
/home/maxime/Projects/dspy/docs/docs/learn/programming/overview.md	18	program	program	with much higher portability For example if you write a	using DSPy modules you can swap the LM or its
/home/maxime/Projects/dspy/docs/docs/learn/programming/overview.md	18	ProgramOfThought	program	exchange one _module_ like dspy ChainOfThought with another like dspy	without modifying your signatures When you're ready to use optimizers
/home/maxime/Projects/dspy/docs/docs/learn/programming/overview.md	18	program	program	your signatures When you're ready to use optimizers the same	can have its prompts optimized or its LM weights fine
/home/maxime/Projects/dspy/docs/docs/production/index.md	17	programs	program	material magnify expand lg middle __Monitoring Observability__ Monitor your DSPy	using MLflow Tracing based on OpenTelemetry octicons arrow right 24
/home/maxime/Projects/dspy/docs/docs/production/index.md	25	programs	program	tutorials observability index md tracing material ab testing __Reproducibility__ Log	metrics configs and environments for full reproducibility with DSPy's native
/home/maxime/Projects/dspy/docs/docs/production/index.md	43	Program	program	support for high throughput environments octicons arrow right 24 Async	api utils asyncify md material alert rhombus __Guardrails Controllability__ DSPy's
/home/maxime/Projects/dspy/docs/docs/production/index.md	51	programming	program	guide LM outputs octicons arrow right 24 Learn Signature learn	signatures md div
/home/maxime/Projects/dspy/docs/docs/roadmap.md	11	programs	program	introduced tens of thousands of people to building modular LM	and optimizing their prompts and weights automatically In this time
/home/maxime/Projects/dspy/docs/docs/roadmap.md	19	programming	program	to shift from ad hoc prompting to new notions of	LMs Instead of relying on LMs gaining much more general
/home/maxime/Projects/dspy/docs/docs/roadmap.md	19	programming	program	and shared infrastructure for the collective development of the abstractions	patterns and optimizers toward this thesis To a first approximation
/home/maxime/Projects/dspy/docs/docs/roadmap.md	32	Programs	program	concepts but DSPy seeks to establish and advance core LM	research the framework is propelled by constant academic research from
/home/maxime/Projects/dspy/docs/docs/roadmap.md	32	programming	program	research the framework is propelled by constant academic research from	abstractions like the original Demonstrate Search Predict concepts DSPy Signatures
/home/maxime/Projects/dspy/docs/docs/roadmap.md	58	programs	program	increase the quality of zero shot off the shelf DSPy	i e those not yet compiled on custom data 2
/home/maxime/Projects/dspy/docs/docs/roadmap.md	72	programming	program	Traditionally LMs offer text in text out interfaces Toward modular	DSPy introduced signatures for the first time as DSP Templates
/home/maxime/Projects/dspy/docs/docs/roadmap.md	72	program	program	the latter from data in the context of a bigger	Today in the LM landscape notions of structured outputs have
/home/maxime/Projects/dspy/docs/docs/roadmap.md	79	program	program	notion of compiling to optimize the weights of an LM	To understand just how long ago that was in AI
/home/maxime/Projects/dspy/docs/docs/roadmap.md	81	program	program	to bootstrap training data for several different modules in a	train multiple models and handle model selection and then load
/home/maxime/Projects/dspy/docs/docs/roadmap.md	81	program's	program	and then load and plug in those models into the	modules Doing this robustly at the level of abstraction DSPy
/home/maxime/Projects/dspy/docs/docs/roadmap.md	92	programs	program	focuses on optimizing the prompts and the weights of LM	In December 2022 we introduced the algorithm and abstractions behind
/home/maxime/Projects/dspy/docs/docs/roadmap.md	92	programs	program	optimization and BetterTogether for fine tuning the weights of LM	We have been working towards a number of stronger optimizers
/home/maxime/Projects/dspy/docs/docs/roadmap.md	96	program	program	various LMs How effective does it need the zero shot	to be in order to work well 2 Cost How
/home/maxime/Projects/dspy/docs/docs/roadmap.md	97	program	program	unlabeled inputs does it need How many invocations of the	does it need How expensive is the resulting optimized program
/home/maxime/Projects/dspy/docs/docs/roadmap.md	97	program	program	program does it need How expensive is the resulting optimized	at inference time 3 Robustness How well can it generalize
/home/maxime/Projects/dspy/docs/docs/roadmap.md	104	program	program	and a good metric starting from a decent zero shot	Various efforts here are led by Dilara Soylu Michael Ryan
/home/maxime/Projects/dspy/docs/docs/roadmap.md	106	program	program	inputs with labels ii starting with a weak zero shot	that scores 0 iii where significant misalignment exists between train
/home/maxime/Projects/dspy/docs/docs/roadmap.md	114	program	program	collection to deployment that serves and monitors the optimized DSPy	in practice This is just starting but efforts will be
/home/maxime/Projects/dspy/docs/docs/roadmap.md	119	program	program	the metadata returned by optimizers Similarly they can rely on	save and program load to potentially adjust the optimized prompts
/home/maxime/Projects/dspy/docs/docs/roadmap.md	119	program	program	by optimizers Similarly they can rely on program save and	load to potentially adjust the optimized prompts by hand Alternatively
/home/maxime/Projects/dspy/docs/docs/roadmap.md	119	program	program	and candidate prompts DSPy encourages iterative engineering by adjusting the	data or metrics across optimization runs For example some optimizers
/home/maxime/Projects/dspy/docs/docs/roadmap.md	123	programs	program	ii experimental tracking iii cost management and iii deployment of	should become first class concerns via integration with tools like
/home/maxime/Projects/dspy/docs/docs/tutorials/ai_text_game/index.md	3	programming	program	create an interactive text based adventure game using DSPy's modular	approach You'll build a dynamic game where AI handles narrative
/home/maxime/Projects/dspy/docs/docs/tutorials/async/index.md	1	Programming	program	Async DSPy	DSPy provides native support for asynchronous programming allowing you to
/home/maxime/Projects/dspy/docs/docs/tutorials/async/index.md	3	programming	program	Async DSPy Programming DSPy provides native support for asynchronous	allowing you to build more efficient and scalable applications This
/home/maxime/Projects/dspy/docs/docs/tutorials/async/index.md	9	programming	program	modules and custom implementations Why Use Async in DSPy Asynchronous	in DSPy offers several benefits Improved performance through concurrent operations
/home/maxime/Projects/dspy/docs/docs/tutorials/async/index.md	17	programming	program	I use Sync or Async Choosing between synchronous and asynchronous	in DSPy depends on your specific use case Here's a
/home/maxime/Projects/dspy/docs/docs/tutorials/async/index.md	20	Programming	program	guide to help you make the right choice Use Synchronous	When You're exploring or prototyping new ideas You're conducting research
/home/maxime/Projects/dspy/docs/docs/tutorials/async/index.md	28	Programming	program	code You want easier debugging and error tracking Use Asynchronous	When You're building a high throughput service high QPS You're
/home/maxime/Projects/dspy/docs/docs/tutorials/async/index.md	37	programming	program	production service that requires high scalability Important Considerations While async	offers performance benefits it comes with some trade offs More
/home/maxime/Projects/dspy/docs/docs/tutorials/async/index.md	44	programming	program	notebooks and normal python runtime We recommend starting with synchronous	for most development scenarios and switching to async only when
/home/maxime/Projects/dspy/docs/docs/tutorials/async/index.md	46	programming	program	your application before dealing with the additional complexity of async	Using Built in Modules Asynchronously Most DSPy built in modules
/home/maxime/Projects/dspy/docs/docs/tutorials/async/index.md	127	programming	program	more details on async tools see the Tools documentation learn	tools md async tools Note When using dspy ReAct with
/home/maxime/Projects/dspy/docs/docs/tutorials/build_ai_program/index.md	1	Programs	program	Build AI	with DSPy This section contains hands on tutorials that guide
/home/maxime/Projects/dspy/docs/docs/tutorials/build_ai_program/index.md	3	programming	program	use cases and shows you how to leverage DSPy's modular	approach to create robust maintainable AI systems Core Applications Managing
/home/maxime/Projects/dspy/docs/docs/tutorials/build_ai_program/index.md	40	Program	program	small local model and an advanced external model Advanced Reasoning	Of Thought program_of_thought index ipynb Learn to build systems that
/home/maxime/Projects/dspy/docs/docs/tutorials/build_ai_program/index.md	40	program_of_thought	program	and an advanced external model Advanced Reasoning Program Of Thought	index ipynb Learn to build systems that can generate and
/home/maxime/Projects/dspy/docs/docs/tutorials/build_ai_program/index.md	41	programmatic	program	solve complex problems combining the power of language models with	reasoning Multimodal Applications Image Generation Prompt iteration image_generation_prompting index ipynb
/home/maxime/Projects/dspy/docs/docs/tutorials/core_development/index.md	11	programs	program	iterative refinement to get higher quality results from your DSPy	Data Management and Persistence Saving and Loading saving index md
/home/maxime/Projects/dspy/docs/docs/tutorials/core_development/index.md	16	programs	program	saving index md Understand how to persist and restore DSPy	and their optimized states Learn best practices for model versioning
/home/maxime/Projects/dspy/docs/docs/tutorials/core_development/index.md	16	program	program	states Learn best practices for model versioning checkpoint management and	serialization Cache cache index md Implement efficient caching strategies to
/home/maxime/Projects/dspy/docs/docs/tutorials/deployment/index.md	1	program	program	Tutorial Deploying your DSPy	This guide demonstrates two potential ways to deploy your DSPy
/home/maxime/Projects/dspy/docs/docs/tutorials/deployment/index.md	3	program	program	This guide demonstrates two potential ways to deploy your DSPy	in production FastAPI for lightweight deployments and MLflow for more
/home/maxime/Projects/dspy/docs/docs/tutorials/deployment/index.md	3	program	program	lightweight deployments and MLflow for more production grade deployments with	versioning and management Below we'll assume you have the following
/home/maxime/Projects/dspy/docs/docs/tutorials/deployment/index.md	5	program	program	management Below we'll assume you have the following simple DSPy	that you want to deploy You can replace this with
/home/maxime/Projects/dspy/docs/docs/tutorials/deployment/index.md	11	dspy_program	program	dspy dspy configure lm dspy LM openai gpt 4o mini	dspy ChainOfThought question answer Deploying with FastAPI FastAPI offers a
/home/maxime/Projects/dspy/docs/docs/tutorials/deployment/index.md	16	program	program	FastAPI FastAPI offers a straightforward way to serve your DSPy	as a REST API This is ideal when you have
/home/maxime/Projects/dspy/docs/docs/tutorials/deployment/index.md	16	program	program	This is ideal when you have direct access to your	code and need a lightweight deployment solution bash pip install
