file	line	word	matched_stem	before_10	after_10
/home/maxime/Projects/dspy/docs/docs/api/modules/ProgramOfThought.md	1	ProgramOfThought	program	dspy	START_API_REF dspy ProgramOfThought handler python options members __call__ acall batch
/home/maxime/Projects/dspy/docs/docs/api/modules/ProgramOfThought.md	4	ProgramOfThought	program	dspy ProgramOfThought START_API_REF dspy	handler python options members __call__ acall batch deepcopy dump_state forward
/home/maxime/Projects/dspy/docs/docs/api/modules/RLM.md	3	programmatically	program	Recursive Language Model is a DSPy module that lets LLMs	explore large contexts through a sandboxed Python REPL Instead of
/home/maxime/Projects/dspy/docs/docs/api/modules/RLM.md	14	programmatic	program	in the LLM's context window effectively The task benefits from	exploration searching filtering aggregating chunking You need the LLM to
/home/maxime/Projects/dspy/docs/docs/api/optimizers/BetterTogether.md	3	program	program	by applying them in a configurable sequence allowing a student	to iteratively improve both its prompts and model parameters The
/home/maxime/Projects/dspy/docs/docs/api/optimizers/BetterTogether.md	29	program	program	sequence evaluating each intermediate result and returning the best performing	Here's how it works 1 Initialization with Custom Optimizers When
/home/maxime/Projects/dspy/docs/docs/api/optimizers/BetterTogether.md	66	program	program	shuffle_trainset_between_steps True The optimizer is run on the current student	The result is evaluated on the validation set The candidate
/home/maxime/Projects/dspy/docs/docs/api/optimizers/BetterTogether.md	68	program	program	The result is evaluated on the validation set The candidate	and score are recorded Since BetterTogether is a meta optimizer
/home/maxime/Projects/dspy/docs/docs/api/optimizers/BetterTogether.md	87	Program	program	trainset valset valset strategy mipro gepa mipro 3 Validation and	Selection BetterTogether can use a validation set in three ways
/home/maxime/Projects/dspy/docs/docs/api/optimizers/BetterTogether.md	95	program	program	no validation occurs After all optimization steps complete the best	is selected based on validation set availability With validation The
/home/maxime/Projects/dspy/docs/docs/api/optimizers/BetterTogether.md	97	program	program	is selected based on validation set availability With validation The	with the best score is returned with earlier programs winning
/home/maxime/Projects/dspy/docs/docs/api/optimizers/BetterTogether.md	97	programs	program	The program with the best score is returned with earlier	winning ties Without validation The latest program is returned If
/home/maxime/Projects/dspy/docs/docs/api/optimizers/BetterTogether.md	98	program	program	returned with earlier programs winning ties Without validation The latest	is returned If an optimization step fails The error is
/home/maxime/Projects/dspy/docs/docs/api/optimizers/BetterTogether.md	103	program	program	is logged with full traceback Optimization stops early The best	found so far is returned flag_compilation_error_occurred is set to True
/home/maxime/Projects/dspy/docs/docs/api/optimizers/BetterTogether.md	106	program	program	far is returned flag_compilation_error_occurred is set to True The returned	includes two additional attributes candidate_programs List of all evaluated programs
/home/maxime/Projects/dspy/docs/docs/api/optimizers/BetterTogether.md	108	candidate_programs	program	set to True The returned program includes two additional attributes	List of all evaluated programs with their scores and strategies
/home/maxime/Projects/dspy/docs/docs/api/optimizers/BetterTogether.md	108	programs	program	program includes two additional attributes candidate_programs List of all evaluated	with their scores and strategies sorted by score best first
/home/maxime/Projects/dspy/docs/docs/api/optimizers/BetterTogether.md	108	programs	program	first When an error occurs this contains all successfully evaluated	up to the point of failure flag_compilation_error_occurred Boolean indicating if
/home/maxime/Projects/dspy/docs/docs/api/optimizers/BetterTogether.md	120	program	program	argument cannot be included in optimizer_compile_args BetterTogether manages the student	for all optimizers See the compile method docstring for detailed
/home/maxime/Projects/dspy/docs/docs/api/optimizers/BetterTogether.md	157	programming	program	world application combining BetterTogether with GEPA DSPy Optimizers Overview learn	optimizers md
/home/maxime/Projects/dspy/docs/docs/api/optimizers/GEPA/GEPA_Advanced.md	7	program	program	GEPA optimization When GEPA identifies underperforming components in your DSPy	the instruction proposer analyzes execution traces feedback and failures to
/home/maxime/Projects/dspy/docs/docs/api/optimizers/GEPA/GEPA_Advanced.md	47	optimized_program	program	5 temperature 1 0 max_tokens 32000 api_key api_key auto medium	gepa compile student trainset examples When to Use Custom instruction_proposer
/home/maxime/Projects/dspy/docs/docs/api/optimizers/GEPA/GEPA_Advanced.md	326	program	program	The component_selector parameter controls which components predictors in your DSPy	are selected for optimization at each GEPA iteration Instead of
/home/maxime/Projects/dspy/docs/docs/api/optimizers/GEPA/GEPA_Advanced.md	388	program	program	in the current minibatch candidate_idx int Index of the current	candidate being optimized candidate dict str str Component name instruction
/home/maxime/Projects/dspy/docs/docs/api/optimizers/GEPA/overview.md	42	program	program	results are available in the detailed_results attribute of the optimized	returned by GEPA and has the following type START_API_REF dspy
/home/maxime/Projects/dspy/docs/docs/api/optimizers/GEPA/overview.md	60	gepa_ai_program	program	Usage Examples See GEPA usage tutorials in GEPA Tutorials tutorials	index md Inference Time Search GEPA can act as a
/home/maxime/Projects/dspy/docs/docs/api/optimizers/GEPA/overview.md	77	program	program	feedback targeting a chosen module and proposing a new instruction	text tailored to real observed failures and rich textual environmental
/home/maxime/Projects/dspy/docs/docs/api/optimizers/GEPA/overview.md	89	program	program	Summary 1 Initialize the candidate pool with the the unoptimized	2 Iterate Sample a candidate from Pareto frontier Sample a
/home/maxime/Projects/dspy/docs/docs/api/optimizers/GEPA/overview.md	128	gepa_ai_program	program	evolution pipeline used by dspy GEPA optimizer DSPy Tutorials tutorials	index md
/home/maxime/Projects/dspy/docs/docs/api/optimizers/InferRules.md	9	evaluate_program	program	dspy InferRules START_API_REF dspy InferRules handler python options members compile	format_examples get_params get_predictor_demos induce_natural_language_rules update_program_instructions show_source true show_root_heading true heading_level
/home/maxime/Projects/dspy/docs/docs/api/optimizers/InferRules.md	14	update_program_instructions	program	handler python options members compile evaluate_program format_examples get_params get_predictor_demos induce_natural_language_rules	show_source true show_root_heading true heading_level 2 docstring_style google show_root_full_path true
/home/maxime/Projects/dspy/docs/docs/api/optimizers/MIPROv2.md	25	program	program	show_object_full_path false separate_signature false inherited_members true END_API_REF Example Usage The	below shows optimizing a math program with MIPROv2 python import
/home/maxime/Projects/dspy/docs/docs/api/optimizers/MIPROv2.md	25	program	program	END_API_REF Example Usage The program below shows optimizing a math	with MIPROv2 python import dspy from dspy datasets gsm8k import
/home/maxime/Projects/dspy/docs/docs/api/optimizers/MIPROv2.md	44	program	program	Can choose between light medium and heavy optimization runs Optimize	print f Optimizing program with MIPROv2 gsm8k GSM8K optimized_program teleprompter
/home/maxime/Projects/dspy/docs/docs/api/optimizers/MIPROv2.md	45	program	program	medium and heavy optimization runs Optimize program print f Optimizing	with MIPROv2 gsm8k GSM8K optimized_program teleprompter compile dspy ChainOfThought question
/home/maxime/Projects/dspy/docs/docs/api/optimizers/MIPROv2.md	47	optimized_program	program	Optimize program print f Optimizing program with MIPROv2 gsm8k GSM8K	teleprompter compile dspy ChainOfThought question answer trainset gsm8k train Save
/home/maxime/Projects/dspy/docs/docs/api/optimizers/MIPROv2.md	52	program	program	compile dspy ChainOfThought question answer trainset gsm8k train Save optimize	for future use optimized_program save f optimized json How MIPROv2
/home/maxime/Projects/dspy/docs/docs/api/optimizers/MIPROv2.md	53	optimized_program	program	answer trainset gsm8k train Save optimize program for future use	save f optimized json How MIPROv2 works At a high
/home/maxime/Projects/dspy/docs/docs/api/optimizers/MIPROv2.md	58	program	program	examples and new instructions for each predictor in your LM	and then searching over these using Bayesian Optimization to find
/home/maxime/Projects/dspy/docs/docs/api/optimizers/MIPROv2.md	58	program	program	to find the best combination of these variables for your	If you want a visual explanation check out this twitter
/home/maxime/Projects/dspy/docs/docs/api/optimizers/MIPROv2.md	62	program	program	from your training set and run them through your LM	If the output from the program is correct for this
/home/maxime/Projects/dspy/docs/docs/api/optimizers/MIPROv2.md	62	program	program	them through your LM program If the output from the	is correct for this example it is kept as a
/home/maxime/Projects/dspy/docs/docs/api/optimizers/MIPROv2.md	64	program's	program	the training dataset 2 a generated summary of your LM	code and the specific predictor that an instruction is being
/home/maxime/Projects/dspy/docs/docs/api/optimizers/MIPROv2.md	66	program	program	instructions and demonstrations work best for each predictor in our	This works by running a series of num_trials trials where
/home/maxime/Projects/dspy/docs/docs/api/optimizers/MIPROv2.md	66	program	program	minibatch_full_eval_steps At the end of the optimization process the LM	with the set of prompts that performed best on the
/home/maxime/Projects/dspy/docs/docs/api/optimizers/SIMBA.md	24	optimized_program	program	true END_API_REF Example Usage python optimizer dspy SIMBA metric your_metric	optimizer compile your_program trainset your_trainset Save optimize program for future
/home/maxime/Projects/dspy/docs/docs/api/optimizers/SIMBA.md	24	your_program	program	Usage python optimizer dspy SIMBA metric your_metric optimized_program optimizer compile	trainset your_trainset Save optimize program for future use optimized_program save
/home/maxime/Projects/dspy/docs/docs/api/optimizers/SIMBA.md	26	program	program	metric your_metric optimized_program optimizer compile your_program trainset your_trainset Save optimize	for future use optimized_program save f optimized json How SIMBA
/home/maxime/Projects/dspy/docs/docs/api/optimizers/SIMBA.md	27	optimized_program	program	compile your_program trainset your_trainset Save optimize program for future use	save f optimized json How SIMBA works SIMBA Stochastic Introspective
/home/maxime/Projects/dspy/docs/docs/cheatsheet.md	9	Programs	program	This page will contain snippets for frequent usage patterns DSPy	Forcing fresh LM outputs DSPy caches LM calls Provide a
/home/maxime/Projects/dspy/docs/docs/cheatsheet.md	42	ProgramOfThought	program	the color of the sky pred generate_answer question question dspy	python pot dspy ProgramOfThought BasicQA question Sarah has 5 apples
/home/maxime/Projects/dspy/docs/docs/cheatsheet.md	45	ProgramOfThought	program	sky pred generate_answer question question dspy ProgramOfThought python pot dspy	BasicQA question Sarah has 5 apples She buys 7 more
/home/maxime/Projects/dspy/docs/docs/cheatsheet.md	51	ProgramOfThought	program	print f Question question print f Final Predicted Answer after	process result answer dspy ReAct python react_module dspy ReAct BasicQA
/home/maxime/Projects/dspy/docs/docs/cheatsheet.md	168	evaluate_program	program	factual factually_correct DSPy Evaluation python from dspy evaluate import Evaluate	Evaluate devset devset metric your_defined_metric num_threads NUM_THREADS display_progress True display_table
/home/maxime/Projects/dspy/docs/docs/cheatsheet.md	170	evaluate_program	program	devset devset metric your_defined_metric num_threads NUM_THREADS display_progress True display_table num_rows_to_display	your_dspy_program DSPy Optimizers LabeledFewShot python from dspy teleprompt import LabeledFewShot
/home/maxime/Projects/dspy/docs/docs/cheatsheet.md	170	your_dspy_program	program	devset metric your_defined_metric num_threads NUM_THREADS display_progress True display_table num_rows_to_display evaluate_program	DSPy Optimizers LabeledFewShot python from dspy teleprompt import LabeledFewShot labeled_fewshot_optimizer
/home/maxime/Projects/dspy/docs/docs/cheatsheet.md	181	your_dspy_program_compiled	program	python from dspy teleprompt import LabeledFewShot labeled_fewshot_optimizer LabeledFewShot k 8	labeled_fewshot_optimizer compile student your_dspy_program trainset trainset BootstrapFewShot python from dspy
/home/maxime/Projects/dspy/docs/docs/cheatsheet.md	181	your_dspy_program	program	import LabeledFewShot labeled_fewshot_optimizer LabeledFewShot k 8 your_dspy_program_compiled labeled_fewshot_optimizer compile student	trainset trainset BootstrapFewShot python from dspy teleprompt import BootstrapFewShot fewshot_optimizer
/home/maxime/Projects/dspy/docs/docs/cheatsheet.md	191	your_dspy_program_compiled	program	metric your_defined_metric max_bootstrapped_demos 4 max_labeled_demos 16 max_rounds 1 max_errors 10	fewshot_optimizer compile student your_dspy_program trainset trainset Using another LM for
/home/maxime/Projects/dspy/docs/docs/cheatsheet.md	191	your_dspy_program	program	max_labeled_demos 16 max_rounds 1 max_errors 10 your_dspy_program_compiled fewshot_optimizer compile student	trainset trainset Using another LM for compilation specifying in teacher_settings
/home/maxime/Projects/dspy/docs/docs/cheatsheet.md	201	your_dspy_program_compiled	program	max_labeled_demos 16 max_rounds 1 max_errors 10 teacher_settings dict lm gpt4	fewshot_optimizer compile student your_dspy_program trainset trainset Compiling a compiled program
/home/maxime/Projects/dspy/docs/docs/cheatsheet.md	201	your_dspy_program	program	max_errors 10 teacher_settings dict lm gpt4 your_dspy_program_compiled fewshot_optimizer compile student	trainset trainset Compiling a compiled program bootstrapping a bootstrapped program
/home/maxime/Projects/dspy/docs/docs/cheatsheet.md	204	program	program	your_dspy_program_compiled fewshot_optimizer compile student your_dspy_program trainset trainset Compiling a compiled	bootstrapping a bootstrapped program python your_dspy_program_compiledx2 teleprompter compile your_dspy_program teacher
/home/maxime/Projects/dspy/docs/docs/cheatsheet.md	204	program	program	your_dspy_program trainset trainset Compiling a compiled program bootstrapping a bootstrapped	python your_dspy_program_compiledx2 teleprompter compile your_dspy_program teacher your_dspy_program_compiled trainset trainset Saving
/home/maxime/Projects/dspy/docs/docs/cheatsheet.md	207	your_dspy_program_compiledx2	program	trainset Compiling a compiled program bootstrapping a bootstrapped program python	teleprompter compile your_dspy_program teacher your_dspy_program_compiled trainset trainset Saving loading a
/home/maxime/Projects/dspy/docs/docs/cheatsheet.md	208	your_dspy_program	program	compiled program bootstrapping a bootstrapped program python your_dspy_program_compiledx2 teleprompter compile	teacher your_dspy_program_compiled trainset trainset Saving loading a compiled program python
/home/maxime/Projects/dspy/docs/docs/cheatsheet.md	209	your_dspy_program_compiled	program	bootstrapping a bootstrapped program python your_dspy_program_compiledx2 teleprompter compile your_dspy_program teacher	trainset trainset Saving loading a compiled program python save_path v1
/home/maxime/Projects/dspy/docs/docs/cheatsheet.md	214	program	program	compile your_dspy_program teacher your_dspy_program_compiled trainset trainset Saving loading a compiled	python save_path v1 json your_dspy_program_compiledx2 save save_path python loaded_program YourProgramClass
/home/maxime/Projects/dspy/docs/docs/cheatsheet.md	218	your_dspy_program_compiledx2	program	trainset Saving loading a compiled program python save_path v1 json	save save_path python loaded_program YourProgramClass loaded_program load path save_path BootstrapFewShotWithRandomSearch
/home/maxime/Projects/dspy/docs/docs/cheatsheet.md	222	loaded_program	program	compiled program python save_path v1 json your_dspy_program_compiledx2 save save_path python	YourProgramClass loaded_program load path save_path BootstrapFewShotWithRandomSearch Detailed documentation on BootstrapFewShotWithRandomSearch
/home/maxime/Projects/dspy/docs/docs/cheatsheet.md	222	YourProgramClass	program	program python save_path v1 json your_dspy_program_compiledx2 save save_path python loaded_program	loaded_program load path save_path BootstrapFewShotWithRandomSearch Detailed documentation on BootstrapFewShotWithRandomSearch can
/home/maxime/Projects/dspy/docs/docs/cheatsheet.md	223	loaded_program	program	python save_path v1 json your_dspy_program_compiledx2 save save_path python loaded_program YourProgramClass	load path save_path BootstrapFewShotWithRandomSearch Detailed documentation on BootstrapFewShotWithRandomSearch can be
/home/maxime/Projects/dspy/docs/docs/cheatsheet.md	233	num_candidate_programs	program	dspy teleprompt import BootstrapFewShotWithRandomSearch fewshot_optimizer BootstrapFewShotWithRandomSearch metric your_defined_metric max_bootstrapped_demos 2	8 num_threads NUM_THREADS your_dspy_program_compiled fewshot_optimizer compile student your_dspy_program trainset trainset
/home/maxime/Projects/dspy/docs/docs/cheatsheet.md	235	your_dspy_program_compiled	program	fewshot_optimizer BootstrapFewShotWithRandomSearch metric your_defined_metric max_bootstrapped_demos 2 num_candidate_programs 8 num_threads NUM_THREADS	fewshot_optimizer compile student your_dspy_program trainset trainset valset devset Other custom
/home/maxime/Projects/dspy/docs/docs/cheatsheet.md	235	your_dspy_program	program	max_bootstrapped_demos 2 num_candidate_programs 8 num_threads NUM_THREADS your_dspy_program_compiled fewshot_optimizer compile student	trainset trainset valset devset Other custom configurations are similar to
/home/maxime/Projects/dspy/docs/docs/cheatsheet.md	247	num_candidate_programs	program	teleprompt ensemble import Ensemble fewshot_optimizer BootstrapFewShotWithRandomSearch metric your_defined_metric max_bootstrapped_demos 2	8 num_threads NUM_THREADS your_dspy_program_compiled fewshot_optimizer compile student your_dspy_program trainset trainset
/home/maxime/Projects/dspy/docs/docs/cheatsheet.md	248	your_dspy_program_compiled	program	fewshot_optimizer BootstrapFewShotWithRandomSearch metric your_defined_metric max_bootstrapped_demos 2 num_candidate_programs 8 num_threads NUM_THREADS	fewshot_optimizer compile student your_dspy_program trainset trainset valset devset ensemble_optimizer Ensemble
/home/maxime/Projects/dspy/docs/docs/cheatsheet.md	248	your_dspy_program	program	max_bootstrapped_demos 2 num_candidate_programs 8 num_threads NUM_THREADS your_dspy_program_compiled fewshot_optimizer compile student	trainset trainset valset devset ensemble_optimizer Ensemble reduce_fn dspy majority programs
/home/maxime/Projects/dspy/docs/docs/cheatsheet.md	251	programs	program	your_dspy_program trainset trainset valset devset ensemble_optimizer Ensemble reduce_fn dspy majority	x 1 for x in your_dspy_program_compiled candidate_programs your_dspy_program_compiled_ensemble ensemble_optimizer compile
/home/maxime/Projects/dspy/docs/docs/cheatsheet.md	251	your_dspy_program_compiled	program	Ensemble reduce_fn dspy majority programs x 1 for x in	candidate_programs your_dspy_program_compiled_ensemble ensemble_optimizer compile programs 3 BootstrapFinetune python from dspy
/home/maxime/Projects/dspy/docs/docs/cheatsheet.md	251	candidate_programs	program	reduce_fn dspy majority programs x 1 for x in your_dspy_program_compiled	your_dspy_program_compiled_ensemble ensemble_optimizer compile programs 3 BootstrapFinetune python from dspy teleprompt
/home/maxime/Projects/dspy/docs/docs/cheatsheet.md	252	your_dspy_program_compiled_ensemble	program	dspy majority programs x 1 for x in your_dspy_program_compiled candidate_programs	ensemble_optimizer compile programs 3 BootstrapFinetune python from dspy teleprompt import
/home/maxime/Projects/dspy/docs/docs/cheatsheet.md	252	programs	program	x 1 for x in your_dspy_program_compiled candidate_programs your_dspy_program_compiled_ensemble ensemble_optimizer compile	3 BootstrapFinetune python from dspy teleprompt import BootstrapFewShotWithRandomSearch BootstrapFinetune Compile
/home/maxime/Projects/dspy/docs/docs/cheatsheet.md	260	program	program	3 BootstrapFinetune python from dspy teleprompt import BootstrapFewShotWithRandomSearch BootstrapFinetune Compile	on current dspy settings lm fewshot_optimizer BootstrapFewShotWithRandomSearch metric your_defined_metric max_bootstrapped_demos
/home/maxime/Projects/dspy/docs/docs/cheatsheet.md	262	your_dspy_program_compiled	program	settings lm fewshot_optimizer BootstrapFewShotWithRandomSearch metric your_defined_metric max_bootstrapped_demos 2 num_threads NUM_THREADS	tp compile your_dspy_program trainset trainset some_num valset trainset some_num Configure
/home/maxime/Projects/dspy/docs/docs/cheatsheet.md	262	your_dspy_program	program	BootstrapFewShotWithRandomSearch metric your_defined_metric max_bootstrapped_demos 2 num_threads NUM_THREADS your_dspy_program_compiled tp compile	trainset trainset some_num valset trainset some_num Configure model to finetune
/home/maxime/Projects/dspy/docs/docs/cheatsheet.md	267	program	program	bf16 True bsize 6 accumsteps 2 lr 5e 5 Compile	on BootstrapFinetune finetune_optimizer BootstrapFinetune metric your_defined_metric finetune_program finetune_optimizer compile your_dspy_program
/home/maxime/Projects/dspy/docs/docs/cheatsheet.md	269	finetune_program	program	5e 5 Compile program on BootstrapFinetune finetune_optimizer BootstrapFinetune metric your_defined_metric	finetune_optimizer compile your_dspy_program trainset some_new_dataset_for_finetuning_model config finetune_program your_dspy_program Load program
/home/maxime/Projects/dspy/docs/docs/cheatsheet.md	269	your_dspy_program	program	program on BootstrapFinetune finetune_optimizer BootstrapFinetune metric your_defined_metric finetune_program finetune_optimizer compile	trainset some_new_dataset_for_finetuning_model config finetune_program your_dspy_program Load program and activate model's
/home/maxime/Projects/dspy/docs/docs/cheatsheet.md	271	finetune_program	program	BootstrapFinetune metric your_defined_metric finetune_program finetune_optimizer compile your_dspy_program trainset some_new_dataset_for_finetuning_model config	your_dspy_program Load program and activate model's parameters in program before
/home/maxime/Projects/dspy/docs/docs/cheatsheet.md	271	your_dspy_program	program	metric your_defined_metric finetune_program finetune_optimizer compile your_dspy_program trainset some_new_dataset_for_finetuning_model config finetune_program	Load program and activate model's parameters in program before evaluation
/home/maxime/Projects/dspy/docs/docs/cheatsheet.md	273	program	program	finetune_program finetune_optimizer compile your_dspy_program trainset some_new_dataset_for_finetuning_model config finetune_program your_dspy_program Load	and activate model's parameters in program before evaluation ckpt_path saved_checkpoint_path_from_finetuning
/home/maxime/Projects/dspy/docs/docs/cheatsheet.md	273	program	program	config finetune_program your_dspy_program Load program and activate model's parameters in	before evaluation ckpt_path saved_checkpoint_path_from_finetuning LM dspy HFModel checkpoint ckpt_path model
/home/maxime/Projects/dspy/docs/docs/cheatsheet.md	277	finetune_program	program	LM dspy HFModel checkpoint ckpt_path model model_to_finetune for p in	predictors p lm LM p activated False COPRO Detailed documentation
/home/maxime/Projects/dspy/docs/docs/cheatsheet.md	293	compiled_program_optimized_signature	program	metric your_defined_metric breadth num_new_prompts_generated depth times_to_generate_prompts init_temperature prompt_generation_temperature verbose False	copro_teleprompter compile your_dspy_program trainset trainset eval_kwargs eval_kwargs MIPROv2 Note detailed
/home/maxime/Projects/dspy/docs/docs/cheatsheet.md	293	your_dspy_program	program	num_new_prompts_generated depth times_to_generate_prompts init_temperature prompt_generation_temperature verbose False compiled_program_optimized_signature copro_teleprompter compile	trainset trainset eval_kwargs eval_kwargs MIPROv2 Note detailed documentation can be
/home/maxime/Projects/dspy/docs/docs/cheatsheet.md	314	program	program	Can choose between light medium and heavy optimization runs Optimize	print f Optimizing program with MIPRO optimized_program teleprompter compile program
/home/maxime/Projects/dspy/docs/docs/cheatsheet.md	315	program	program	medium and heavy optimization runs Optimize program print f Optimizing	with MIPRO optimized_program teleprompter compile program deepcopy trainset trainset max_bootstrapped_demos
/home/maxime/Projects/dspy/docs/docs/cheatsheet.md	316	optimized_program	program	optimization runs Optimize program print f Optimizing program with MIPRO	teleprompter compile program deepcopy trainset trainset max_bootstrapped_demos 3 max_labeled_demos 4
